{
  "version": 1,
  "scope": "six authoritative matched runs, with the completed low-thinking Gemini generation recovery replacing the original Gemini comparison; canonical 24 cases, adjudications and necessary evidence",
  "original_dashboard_sha256": "8168275a9bce02c9ad6421c4ca865476239c93ca68ce8e294ed0b00ed66115ba",
  "configuration_sha256": "2d73980aa1dbc5d2a68395cae0085e60d1fab31a8892840bcd65ae10cf45ac17",
  "publication_tables_sha256": "a2c90a106ccbc0437d1e276629f82c1f828401f67a6e0997cc0984cad8c05ee5",
  "representations": {
    "benchmarks/context_evaluation/heldout/results/20261008T014713Z/manifest.json": {
      "path": "benchmarks/context_evaluation/heldout/results/20261008T014713Z/manifest.public-v1.json",
      "original_sha256": "6976e172872315ec226445cb07a86571fd7fd78b3a9f30e2f4bccc27a1137cba",
      "sha256": "d66afc871c40e73d591d6e011aab47458e03f294a3a13fe2859e5c86e4622ed7"
    },
    "benchmarks/context_evaluation/heldout/results/bge-claude-vs-bge-omneum-20261008/manifest.json": {
      "path": "benchmarks/context_evaluation/heldout/results/bge-claude-vs-bge-omneum-20261008/manifest.public-v1.json",
      "original_sha256": "4dc04c60071091a4cc2b2fe8b032c39fe5ef7a2b3c0433b86844727c6ceec713",
      "sha256": "8014daafbf905a4dc51b23f1b612c4221664e92951fac558d7e4dc8302ab817c"
    },
    "benchmarks/context_evaluation/heldout/results/bge-omneum-tied-maxima-20261007/manifest.json": {
      "path": "benchmarks/context_evaluation/heldout/results/bge-omneum-tied-maxima-20261007/manifest.public-v1.json",
      "original_sha256": "c5f3a167a734faa51f9566c930a030fa6ea15e9dd21d118aaf620abd267bc435",
      "sha256": "4b76aa050efedbc20e6346f4adc250a89446b445cbb76dddcb5f428d71c592b6"
    },
    "benchmarks/context_evaluation/heldout/results/bge-openai-vs-bge-omneum-20261008/manifest.json": {
      "path": "benchmarks/context_evaluation/heldout/results/bge-openai-vs-bge-omneum-20261008/manifest.public-v1.json",
      "original_sha256": "be6320d1498c125bcf12015e41eac8ecac38762bea03381ab9765e4b581641b3",
      "sha256": "52c65a93377022dfdfad61ae274dc5a3adbe1f588bd5a4f844588c9b377760a9"
    },
    "benchmarks/context_evaluation/heldout/results/cohere-claude-vs-cohere-omneum-20261008/manifest.json": {
      "path": "benchmarks/context_evaluation/heldout/results/cohere-claude-vs-cohere-omneum-20261008/manifest.public-v1.json",
      "original_sha256": "832c7851c3b26e527f5c711350872b170cf13b2da1d767d1b4bfeb084d4505f6",
      "sha256": "0cddd802ce99b6937d678f81d1bd7f24ed340423ecae1caca960acaef6c487f6"
    },
    "benchmarks/context_evaluation/heldout/results/diagnostic-tied-maxima-selection-only-20261007/selection_only_diagnostic.json": {
      "path": "benchmarks/context_evaluation/heldout/results/diagnostic-tied-maxima-selection-only-20261007/selection_only_diagnostic.public-v1.json",
      "original_sha256": "545a3fc79f838074d13dc61f9f443e126fd6b35a428958285cf17a9a38e4df31",
      "sha256": "51279c9920252b1adbd697bebd949835b4963535373b4760bd073ca53ebd4855"
    },
    "benchmarks/context_evaluation/heldout/results/bge-google-low-vs-bge-omneum-20261008/manifest.json": {
      "path": "benchmarks/context_evaluation/heldout/results/bge-google-low-vs-bge-omneum-20261008/manifest.public-v1.json",
      "original_sha256": "757b5f0582dab486edfaee15527d739e294dc853f580728be17d43918254c4fa",
      "sha256": "ab31e2874bcd1aac11f78b8616148239a64da4f1b7b5d3555aa79d3469da5ece"
    }
  },
  "historical_sources": {
    "benchmarks/context_evaluation/heldout/analysis/bge-google-vs-bge-omneum-20261008/analyze_saved.py": {
      "path": "benchmarks/context_evaluation/heldout/contracts/historical/733a022bcc2e5958a499acc148c6e205d49b544fff16645706c27e0d4bb26094/analyze_saved.py.txt",
      "sha256": "733a022bcc2e5958a499acc148c6e205d49b544fff16645706c27e0d4bb26094"
    },
    "benchmarks/context_evaluation/heldout/analysis/bge-openai-vs-bge-omneum-20261008/analyze_saved.py": {
      "path": "benchmarks/context_evaluation/heldout/contracts/historical/b514c4e53ea67faec3eef86b88e69448e6b78da6780289a725aeabceda97a49c/analyze_saved.py.txt",
      "sha256": "b514c4e53ea67faec3eef86b88e69448e6b78da6780289a725aeabceda97a49c"
    },
    "benchmarks/context_evaluation/omneum_rag.py": {
      "path": "benchmarks/context_evaluation/heldout/contracts/historical/75254c691c3c1dd22f08b94276661337fe1a71fc839f10b101d510e1fc2eb202/omneum_rag.py.txt",
      "sha256": "75254c691c3c1dd22f08b94276661337fe1a71fc839f10b101d510e1fc2eb202"
    }
  },
  "artifacts": {
    "benchmarks/context_evaluation/README.md": "3607be93a3a680270a5764d8a38f3f0091a95d10bce3a88f38dc86a0ef6966a0",
    "benchmarks/context_evaluation/__init__.py": "e3b0c44298fc1c149afbf4c8996fb92427ae41e4649b934ca495991b7852b855",
    "benchmarks/context_evaluation/adversarial/__init__.py": "e3b0c44298fc1c149afbf4c8996fb92427ae41e4649b934ca495991b7852b855",
    "benchmarks/context_evaluation/adversarial/circular_sourcing/__init__.py": "e3b0c44298fc1c149afbf4c8996fb92427ae41e4649b934ca495991b7852b855",
    "benchmarks/context_evaluation/adversarial/circular_sourcing/application.py": "dd96c6e123f23458aa17db6b474ee42ff92df943aeb6b34ca8191a5186f64168",
    "benchmarks/context_evaluation/adversarial/circular_sourcing/cases.py": "424ef048148a2873b20abfd8e044c7af07c04ce2a1d1afdbfa1adb275d4a8270",
    "benchmarks/context_evaluation/adversarial/circular_sourcing/run_benchmark.py": "d098a579bb7634a87c5a69ab02294c785625742859a77c78c1cb1b56abc49094",
    "benchmarks/context_evaluation/adversarial/comparison.py": "056021b85bbbf1b6913d18c18c1a6e1333bd9036eb70c31dab8bd47b7fec5373",
    "benchmarks/context_evaluation/adversarial/conflicting_information/__init__.py": "e3b0c44298fc1c149afbf4c8996fb92427ae41e4649b934ca495991b7852b855",
    "benchmarks/context_evaluation/adversarial/conflicting_information/application.py": "e7499ed89daf2a7d4ce4c26776efcc9acadda43b361e1417df6e683c76739b34",
    "benchmarks/context_evaluation/adversarial/conflicting_information/cases.py": "cd84ba1a14368c3dcecb03c2c01c44ba003af7dab93177158d583d64678ec182",
    "benchmarks/context_evaluation/adversarial/conflicting_information/run_benchmark.py": "aa568e3d146d677d7ac231da1f7504848fec3c3d6a490d26538e9dc967297e74",
    "benchmarks/context_evaluation/adversarial/data_staleness/__init__.py": "e3b0c44298fc1c149afbf4c8996fb92427ae41e4649b934ca495991b7852b855",
    "benchmarks/context_evaluation/adversarial/data_staleness/application.py": "a527ac0357d2dadebfca1d3f64f743ac7ff38a43ae2b9edb47d747b315fd660e",
    "benchmarks/context_evaluation/adversarial/data_staleness/cases.py": "34ca7c62cfd3299bc8c0bd8a8929e48713a950215d34b249abd2b0b62e015382",
    "benchmarks/context_evaluation/adversarial/data_staleness/run_benchmark.py": "484c873fbdecb20ce849e444f035074baa59af23a89e96fd9be5bb881d7cfcb5",
    "benchmarks/context_evaluation/adversarial/prompt_injection/__init__.py": "e3b0c44298fc1c149afbf4c8996fb92427ae41e4649b934ca495991b7852b855",
    "benchmarks/context_evaluation/adversarial/prompt_injection/application.py": "bee97e8c1c597cd42f9a6f7cac05d234517beae1c19e0f614d7bd3bce3b34afb",
    "benchmarks/context_evaluation/adversarial/prompt_injection/cases.py": "c5ad7f74ba157f1ede706b3c9f681e98bea91582216088d64627a47258d03ce4",
    "benchmarks/context_evaluation/adversarial/prompt_injection/run_benchmark.py": "186468a572d1c6e81264de707fa6aeb43d5e132616fcb7a8f73a7d23f29344ce",
    "benchmarks/context_evaluation/answer_scoring.py": "fa071b3760e8fc3ce502a0c4d901aab3f720476f809498015064435459f179ee",
    "benchmarks/context_evaluation/application_comparison.py": "b870c15f57e9cd8e2545c26b2b51f32aa411d3246de39c0fb65b611f06d9fa39",
    "benchmarks/context_evaluation/clients.py": "5465663484c0976f160becb407c4149df89a61a8010534a802bcd5959f97fff3",
    "benchmarks/context_evaluation/config.py": "728e0a650530ca30ef80e7e5b8b33e6dbb00fb6d2ebbb547697b40872f193fd0",
    "benchmarks/context_evaluation/deployment.py": "7c913ea1aba176d1730369d06b8c430892fce04f68d9a55c6aff8e611e12333a",
    "benchmarks/context_evaluation/generation.py": "1f494add00bf82eecf0081be944693bf000648f71385a2614fe3b639c0284c61",
    "benchmarks/context_evaluation/heldout/DASHBOARD_SUMMARY.md": "6488074b1ef0a12e951ad3c4ac582d7eaa45896e89e266bea5fced4574758ba9",
    "benchmarks/context_evaluation/heldout/DATASET.md": "7bd699e756e286194c1e4ef5e1afd94b9de10c6f59e1feee29362d5abe6b0294",
    "benchmarks/context_evaluation/heldout/EVIDENCE.md": "a9891ebc9c605fa79803749eabbaf5e1d1638b72414a2e6744d6a401e994b11d",
    "benchmarks/context_evaluation/heldout/LATENCY_ANALYSIS.md": "433a2beac00f78f1b34db3a6dfaa9734aceea5f1488fd63b4acb8444e95d19d2",
    "benchmarks/context_evaluation/heldout/__init__.py": "f68b87095f48e84ec5a8b309bd2deb833c673d9ced573f8d2a9d56603623c391",
    "benchmarks/context_evaluation/heldout/additive_methods.py": "5ed61c4d0c9fa62a8b4f1872b7ce6ed76f0fde5c9e8a58cd64d83774ee8f60ca",
    "benchmarks/context_evaluation/heldout/additive_runner.py": "cec0e2139c2f4d75802b941b4989d3ae918ff649421422a4969dc39e7318113b",
    "benchmarks/context_evaluation/heldout/aggregate.py": "5489b9a2b31b12e3a8f21683ada003fe93a5741f490c36c93d9f7d14f9de615a",
    "benchmarks/context_evaluation/heldout/analysis/bge-openai-vs-bge-omneum-20261008/analyze_saved.py": "03f82212da02a21dc0b46b400734fdf3cf33eb9db77546cfebd272646ec0b445",
    "benchmarks/context_evaluation/heldout/analysis/bge-openai-vs-bge-omneum-20261008/answer_audit.json": "9b8eff56272384556f5ed7fefe9cdd23ab37caa580ea2a67087ffb693536e8e7",
    "benchmarks/context_evaluation/heldout/analysis/bge-openai-vs-bge-omneum-20261008/comparison.json": "4da961caa5eeb0f157a19a54289b22d34e7067f425556c51a40e946e353ee0d5",
    "benchmarks/context_evaluation/heldout/analysis/bge-openai-vs-bge-omneum-20261008/report.md": "2773abef1c74a73d9021d60f1545cfdbfb5e27299afc7fc24e147c729a73efdc",
    "benchmarks/context_evaluation/heldout/artifacts.py": "990c5975e7922cb5f76dce36695bce0dd9fcb95f7a13d3c33599c52adb8aff85",